username,rating,text,scraped_at
testimonial-0,5,We've been using this utility for years - awesome service!,2025-12-23T14:38:37.143417
testimonial-1,5,This Python app simplified my workflow significantly. Highly recommended.,2025-12-23T14:38:37.144078
testimonial-2,4,"Had a few issues at first, but their support team is top-notch!",2025-12-23T14:38:37.144117
testimonial-3,5,A fantastic tool - it has everything you need and more.,2025-12-23T14:38:37.144153
testimonial-4,5,The interface could be a little more user-friendly.,2025-12-23T14:38:37.144187
testimonial-5,5,Been a fan of this app since day one. It just keeps getting better!,2025-12-23T14:38:37.144265
testimonial-6,4,The recent updates really improved the overall experience.,2025-12-23T14:38:37.144302
testimonial-7,3,A decent web app. There's room for improvement though.,2025-12-23T14:38:37.144335
testimonial-8,5,The app is reliable and efficient. I can't imagine my day without it now.,2025-12-23T14:38:37.144368
testimonial-9,1,Encountered some bugs. Hope they fix it soon.,2025-12-23T14:38:37.144399
testimonial-10,5,This web app is a game-changer! I've boosted my productivity.,2025-12-23T14:38:37.144429
testimonial-11,4,The features are great but it took me a while to understand how to use them.,2025-12-23T14:38:37.144463
testimonial-12,4,Love the simplicity and effectiveness of this app.,2025-12-23T14:38:37.144500
testimonial-13,5,"It's an okay tool, but I've used better.",2025-12-23T14:38:37.144533
testimonial-14,5,Fantastic app! It's made my job so much easier.,2025-12-23T14:38:37.144565
testimonial-15,5,"The learning curve is steep, but it's worth it.",2025-12-23T14:38:37.144598
testimonial-16,5,Great concept but needs more work on the execution.,2025-12-23T14:38:37.144628
testimonial-17,4,This app is innovative and has a lot of potentials. Keep it up!,2025-12-23T14:38:37.144658
testimonial-18,5,"It's a solid tool, but there are some minor issues.",2025-12-23T14:38:37.144689
testimonial-19,5,A great app that delivers on its promises. Very impressed.,2025-12-23T14:38:37.144720
testimonial-20,5,I'm blown away by the features and functionality. Incredible app!,2025-12-23T14:38:37.144756
testimonial-21,1,I'm not satisfied with the app's performance. Disappointing.,2025-12-23T14:38:37.144782
testimonial-22,5,The customer support team went above and beyond to help me. Excellent service!,2025-12-23T14:38:37.144814
testimonial-23,5,"The app crashes frequently, making it unreliable for my needs.",2025-12-23T14:38:37.144850
testimonial-24,5,I've recommended this app to all my colleagues. It's a game-changer!,2025-12-23T14:38:37.144880
testimonial-25,5,The user interface is intuitive and well-designed. Easy to navigate.,2025-12-23T14:38:37.144912
testimonial-26,5,I expected more from this app. It didn't meet my expectations.,2025-12-23T14:38:37.144946
testimonial-27,4,The app's performance has improved significantly with the latest update.,2025-12-23T14:38:37.144978
testimonial-28,5,This app has saved me so much time and effort. Highly efficient!,2025-12-23T14:38:37.145009
testimonial-29,4,"There are some minor bugs, but overall, a solid app.",2025-12-23T14:38:37.145041
testimonial-30,4,"I've tried many similar apps, but this one stands out. Impressive!",2025-12-23T14:38:37.145071
testimonial-31,5,The app's user interface could use some improvements. It feels outdated.,2025-12-23T14:38:37.145105
testimonial-32,5,I'm extremely satisfied with the app's performance. Works like a charm!,2025-12-23T14:38:37.145139
testimonial-33,4,The app's documentation is comprehensive and easy to follow.,2025-12-23T14:38:37.145174
testimonial-34,3,I'm disappointed with the lack of updates and new features.,2025-12-23T14:38:37.145205
testimonial-35,5,This app has become an essential part of my workflow. Highly recommended!,2025-12-23T14:38:37.145235
testimonial-36,2,The app is slow and unresponsive at times. Needs optimization.,2025-12-23T14:38:37.145266
testimonial-37,5,I love the clean and modern design of the app. Pleasing to the eye.,2025-12-23T14:38:37.145297
testimonial-38,2,I've encountered several bugs that hindered my productivity.,2025-12-23T14:38:37.145332
testimonial-39,5,This app has become an indispensable tool for me. Great job!,2025-12-23T14:38:37.145366
testimonial-40,2,The app's user interface is cluttered and confusing. Difficult to navigate.,2025-12-23T14:38:37.145396
testimonial-41,5,"I've been using this app for a while now, and it has become an essential part of my daily routine. Highly recommended!",2025-12-23T14:38:37.145428
testimonial-42,1,The customer support team was unresponsive and unhelpful. Disappointing experience.,2025-12-23T14:38:37.145454
testimonial-43,5,This app has revolutionized the way I work. It's efficient and user-friendly.,2025-12-23T14:38:37.145485
testimonial-44,3,"The app's performance is inconsistent. It works well sometimes, but other times it's slow and unresponsive.",2025-12-23T14:38:37.145515
testimonial-45,5,I'm impressed by the frequent updates and new features added to the app. It keeps getting better!,2025-12-23T14:38:37.145546
testimonial-46,2,"I had high hopes for this app, but it failed to meet my expectations. It lacks important features.",2025-12-23T14:38:37.145577
testimonial-47,5,The app's interface is intuitive and easy to navigate. I didn't face any issues while using it.,2025-12-23T14:38:37.145610
testimonial-48,5,This app is a must-have for anyone in the industry. It streamlines processes and saves time.,2025-12-23T14:38:37.145639
testimonial-49,1,I encountered a critical bug that caused data loss. It was a frustrating experience.,2025-12-23T14:38:37.145675
testimonial-50,5,"The app's design is visually appealing, and the user experience is excellent.",2025-12-23T14:38:37.145712
testimonial-51,2,The app's functionality is limited. It needs more features to be truly useful.,2025-12-23T14:38:37.145746
testimonial-52,4,I've had a positive experience using this app. It has improved my productivity significantly.,2025-12-23T14:38:37.145779
testimonial-53,2,"The app crashes frequently, making it unreliable for daily use.",2025-12-23T14:38:37.145806
testimonial-54,5,The app's customer support team was prompt and helpful in resolving my issues. Great service!,2025-12-23T14:38:37.145838
testimonial-55,5,"I've tried many similar apps, but this one stands out with its exceptional performance and features.",2025-12-23T14:38:37.145869
testimonial-56,2,The app's user interface is outdated and not intuitive. It needs a modern redesign.,2025-12-23T14:38:37.145898
testimonial-57,5,I'm extremely satisfied with this app. It has exceeded my expectations in every way.,2025-12-23T14:38:37.145930
testimonial-58,5,"The app's documentation is comprehensive and easy to follow, making it easy to get started.",2025-12-23T14:38:37.145964
testimonial-59,5,The app's performance has been flawless. I haven't experienced any issues or slowdowns.,2025-12-23T14:38:37.145996
